{
    "id": "5",
    "title": "Cellana Panorama",
    "description": "Stake on Cellana for a rich panorama; droplets paint a green diorama.",
    "start_at": 1754221472038,
    "end_at": 1785757217018,
    "status": "active",
    "platform": "cellana",
    "referral_link": "https://cellana.finance/",
    "functions": [
        {
            "entry_function": "0x4bf51972879e3b95c4781a5cdcb9e1ee24ef483e7d22f2d903626f126df62bd1::router::swap_route_entry_from_coin",
            "events": [
                {
                    "name": "0x4bf51972879e3b95c4781a5cdcb9e1ee24ef483e7d22f2d903626f126df62bd1::liquidity_pool::SwapEvent",
                    "rewards": [
                        {
                            "id": "c1",
                            "droplets":200
                        }
                    ]
                }
            ],
            "name": "Swap",
            "description": "Swap any asset pair on Cellana"
        },
        {
            "entry_function": "0x4bf51972879e3b95c4781a5cdcb9e1ee24ef483e7d22f2d903626f126df62bd1::router::create_pool_both_coins",
            "events": [
                {
                    "name": "0x4bf51972879e3b95c4781a5cdcb9e1ee24ef483e7d22f2d903626f126df62bd1::liquidity_pool::CreatePoolEvent",
                    "rewards": [
                        {
                            "id": "c2",
                            "droplets":500
                        }
                    ]
                }
            ],
            "name": "Create Pool",
            "description": "Create a pool on Cellana"
        },
        {
            "entry_function": "0x4bf51972879e3b95c4781a5cdcb9e1ee24ef483e7d22f2d903626f126df62bd1::router::add_liquidity_and_stake_both_coins_entry",
            "events": [
                {
                    "name": "0x4bf51972879e3b95c4781a5cdcb9e1ee24ef483e7d22f2d903626f126df62bd1::liquidity_pool::AddLiquidityEvent",
                    "rewards": [
                        {
                            "id": "c3",
                            "droplets": 500
                        }
                    ]
                }
            ],
            "name": "Deposit Liquidity",
            "description": "Deposit to a liquidity pool on Cellana"
        },
        {
            "entry_function": "0x4bf51972879e3b95c4781a5cdcb9e1ee24ef483e7d22f2d903626f126df62bd1::router::add_liquidity_and_stake_entry",
            "events": [
                {
                    "name": "0x4bf51972879e3b95c4781a5cdcb9e1ee24ef483e7d22f2d903626f126df62bd1::gauge::StakeEvent",
                    "rewards": [
                        {
                            "id": "c4",
                            "droplets": 500
                        }
                    ]
                }
            ],
            "name": "Stake",
            "description": "Stake on Cellana"
        }
    ],
    "action_tags": [
        "swap",
        "create-pool",
        "add-liquidity",
        "stake"
    ]
}