{
    "id": "6",
    "title": "Echelon Resonance",
    "description": "Loop your APT for deep resonance; droplets drum in perfect consonance.",
    "start_at": 1754221472038,
    "end_at": 1785757217018,
    "status": "active",
    "platform": "echelon",
    "referral_link": "https://app.echelon.market/markets?network=aptos_mainnet",
    "functions": [
        {
            "entry_function": "0xc6bc659f1649553c1a3fa05d9727433dc03843baac29473c817d06d39e7621ba::scripts::supply_fa", 
            "events": [
                {
                    "name": "0xc6bc659f1649553c1a3fa05d9727433dc03843baac29473c817d06d39e7621ba::lending::SupplyEvent",
                    "rewards": [
                        {
                            "id": "e1",
                            "droplets": 500
                        }
                    ]
                }
            ],
            "name": "Supply Liquidity on Echelon",
            "description": "Deposit Liquidity on any pool"
        },
        {
            "entry_function": "0xc6bc659f1649553c1a3fa05d9727433dc03843baac29473c817d06d39e7621ba::scripts::supply",
            "events": [
                {
                    "name": "0xc6bc659f1649553c1a3fa05d9727433dc03843baac29473c817d06d39e7621ba::lending::SupplyEvent",
                    "rewards": [
                        {
                            "id": "e2",
                            "droplets": 500
                        }
                    ]
                }
            ],
            "is_duplicate": true
        },
        {
            "entry_function": "0x024c90c44edf46aa02c3e370725b918a59c52b5aa551388feb258bd5a1e82271::isolated_lending::add_collateral",
            "events": [
                {
                    "name": "0x24c90c44edf46aa02c3e370725b918a59c52b5aa551388feb258bd5a1e82271::isolated_lending::AddCollateralEvent",
                    "rewards": [
                        {
                            "id": "e3",
                            "droplets": 500
                        }
                    ]
                }
            ],
            "name": "Lending",
            "description": "",
            "is_duplicate": true
        },
        {
            "entry_function": "0xc6bc659f1649553c1a3fa05d9727433dc03843baac29473c817d06d39e7621ba::scripts::borrow_fa",
            "events": [
                {
                    "name": "0xc6bc659f1649553c1a3fa05d9727433dc03843baac29473c817d06d39e7621ba::lending::BorrowEvent",
                    "rewards": [
                        {
                            "id": "e2",
                            "droplets": 800
                        }
                    ]
                }
            ],
            "name": "Borrow on Echelon",
            "description": ""
        }
    ],
    "action_tags": [
        "supply-liquidity", "deposit-collateral"
    ]
}