{
    "id": "4",
    "title": "Aries Campaign",
    "description": "Trade and lend with blazing flare; droplets spark your tree up there.",
    "start_at": 1754221472038,
    "end_at": 1785757217018,
    "status": "active",
    "platform": "aries",
    "referral_link": "https://app.ariesmarkets.xyz/lending",
    "functions": [
        {
            "entry_function": "0x9770fa9c725cbd97eb50b2be5f7416efdfd1f1554beb0750d4dae4c64e860da3::controller::deposit_fa",
            "events": [
                {
                    "name": "0x9770fa9c725cbd97eb50b2be5f7416efdfd1f1554beb0750d4dae4c64e860da3::profile::SyncProfileDepositEvent",
                    "rewards": [
                        {
                            "id": "a1",
                            "droplets": 500
                        }
                    ]
                }
            ],
            "name": "Supply liquidity on Aries",
            "description": "Supply liquidity on Aries"
        },
        {
            "entry_function": "0x9770fa9c725cbd97eb50b2be5f7416efdfd1f1554beb0750d4dae4c64e860da3::controller::deposit",
            "events": [
                {
                    "name": "0x9770fa9c725cbd97eb50b2be5f7416efdfd1f1554beb0750d4dae4c64e860da3::profile::SyncProfileDepositEvent",
                    "rewards": [
                        {
                            "id": "a1",
                            "droplets": 500
                        }
                    ]
                }
            ],
            "is_duplicate": true
        },
        {
            "entry_function": "0x9770fa9c725cbd97eb50b2be5f7416efdfd1f1554beb0750d4dae4c64e860da3::controller::withdraw_fa",
            "events": [
                {
                    "name": "0x9770fa9c725cbd97eb50b2be5f7416efdfd1f1554beb0750d4dae4c64e860da3::profile::SyncProfileBorrowEvent",
                    "rewards": [
                        {
                            "id": "a1",
                            "droplets": 800
                        }
                    ]
                }
            ],
            "name": "Borrow on Aries",
            "description": ""
        }
    ],
    "action_tags": [
        "deposit-liquidity"
    ]
}