{
  "id": "20",
  "title": "Aptree Christmas Special",
  "description": "The leaves on the forest trees are heavy with snow, where are the elves?, they should be ready to go!",
  "start_at": 1765238400000,
  "end_at": 1765929599000,
  "status": "active",
  "platform": "aptree",
  "referral_link": "https://aptree.io/christmas",
  "action_tags": [],
  "functions": [
        {
            "entry_function": "0x487e905f899ccb6d46fdaec56ba1e0c4cf119862a16c409904b8c78fab1f5e8a::router::swap",
            "events": [
                {
                    "name": "0x487e905f899ccb6d46fdaec56ba1e0c4cf119862a16c409904b8c78fab1f5e8a::router::Swapped",
                    "rewards": [
                        {
                            "id": "tgp",
                            "droplets": 1
                        }
                    ]
                }
            ],
            "name": "Tapp Christmas Swap",
            "description": "Swap 5 times on tapp exchange to get a special present."
        },
        {
            "entry_function": "0x7bd64a730c360a87da24187d6d2e9128310ff25419facb3000d6b2293a06280a::entry::execute_routes",
            "events": [
                {
                    "name": "0x487e905f899ccb6d46fdaec56ba1e0c4cf119862a16c409904b8c78fab1f5e8a::router::Swapped",
                    "rewards": [
                        {
                            "id": "tgp",
                            "droplets": 1
                        }
                    ]
                }
            ],
            "name": "Tapp Christmas Swap",
            "is_duplicate": true
        },
        {
            "entry_function": "0x8b4a2c4bb53857c718a04c020b98f8c2e1f99a68b0f57389a8bf5434cd22e05c::router_v3::swap_batch_coin_entry",
            "events": [
                {
                    "name": "0x8b4a2c4bb53857c718a04c020b98f8c2e1f99a68b0f57389a8bf5434cd22e05c::pool_v3::SwapEventV3",
                    "rewards": [
                        {
                            "id": "hgp",
                            "droplets":1
                        }
                    ]
                }
            ],
            "name": "Hyperion Holiday Swap", 
            "description": "Swap 5 times on Hyperion to for santa to bring you a special reward."
        },
        {
            "entry_function": "0x8b4a2c4bb53857c718a04c020b98f8c2e1f99a68b0f57389a8bf5434cd22e05c::router_v3::swap_batch_coin_directly_deposit_entry",
            "events": [
                {
                    "name": "0x8b4a2c4bb53857c718a04c020b98f8c2e1f99a68b0f57389a8bf5434cd22e05c::pool_v3::SwapEventV3",
                    "rewards": [
                        {
                            "id": "hgp",
                            "droplets":1
                        }
                    ]
                }
            ],
            "name": "Hyperion Holiday Swap", 
            "is_duplicate": true
        },
        {
            "entry_function": "0x8b4a2c4bb53857c718a04c020b98f8c2e1f99a68b0f57389a8bf5434cd22e05c::router_v3::swap_batch_coin_directly_deposit_entry",
            "events": [
                {
                    "name": "0x8b4a2c4bb53857c718a04c020b98f8c2e1f99a68b0f57389a8bf5434cd22e05c::pool_v3::SwapEventV3",
                    "rewards": [
                        {
                            "id": "hgp",
                            "droplets":1
                        }
                    ]
                }
            ],
            "name": "Hyperion Holiday Swap", 
            "is_duplicate": true
        },
        {
            "entry_function": "0x8b4a2c4bb53857c718a04c020b98f8c2e1f99a68b0f57389a8bf5434cd22e05c::router_v3::swap_batch_directly_deposit",
            "events": [
                {
                    "name": "0x8b4a2c4bb53857c718a04c020b98f8c2e1f99a68b0f57389a8bf5434cd22e05c::pool_v3::SwapEventV3",
                    "rewards": [
                        {
                            "id": "hgp",
                            "droplets":1
                        }
                    ]
                }
            ],
            "name": "Hyperion Holiday Swap", 
            "is_duplicate": true
        },
        {
          "entry_function": "0x1::aptos_account::transfer_coins",
          "events": [
            {
              "name": "0x1::fungible_asset::Deposit",
              "rewards": [
                {
                  "id": "pgp",
                  "droplets": 1
                }
              ]
            }
          ],
          "name": "Petra Presents Premier",
          "description": "Send money to 5 friends with petra to get a present."
        },
        {
          "entry_function": "0x1::aptos_account::transfer_fungible_assets",
          "events": [
            {
              "name": "0x1::fungible_asset::Deposit",
              "rewards": [
                {
                  "id": "pgp",
                  "droplets": 1
                }
              ]
            }
          ],
          "is_duplicate": true,
          "name": "Petra Presents Premier"
        }
        
     ]
}
